{
  "schema_version": 2,
  "id": "standard_meeting",
  "name": "Standard Meeting Notes",
  "description": "A standard template for general meetings, focusing on key outcomes and actions.",
  "version": 1,
  "locale": "en",
  "tags": [],
  "source": {
    "type": "builtin",
    "original_file_name": null,
    "original_file_sha256": null,
    "imported_at": null,
    "copied_from_template_id": null
  },
  "created_at": "2026-08-23T00:00:00+08:00",
  "updated_at": "2026-08-23T00:00:00+08:00",
  "sections": [
    {
      "id": "summary",
      "title": "Summary",
      "instruction": "Provide a brief, one-paragraph executive summary of the entire meeting.",
      "format": "paragraph",
      "item_format": null,
      "example_item_format": null,
      "required": true,
      "empty_behavior": "show_not_mentioned"
    },
    {
      "id": "key_decisions",
      "title": "Key Decisions",
      "instruction": "List the most important decisions made during the meeting.",
      "format": "list",
      "item_format": null,
      "example_item_format": null,
      "required": true,
      "empty_behavior": "show_not_mentioned"
    },
    {
      "id": "action_items",
      "title": "Action Items",
      "instruction": "List all assigned tasks with their owners and due date. Keep only conclusions and business fields in the report; source excerpts and timestamps remain internal.",
      "format": "list",
      "item_format": "| **Owner** | Task | Due |\n| --- | --- | --- |",
      "example_item_format": null,
      "required": true,
      "empty_behavior": "show_not_mentioned"
    },
    {
      "id": "discussion_highlights",
      "title": "Discussion Highlights",
      "instruction": "Summarize the main topics of discussion, key arguments, and important insights.",
      "format": "paragraph",
      "item_format": null,
      "example_item_format": null,
      "required": true,
      "empty_behavior": "show_not_mentioned"
    }
  ],
  "extensions": {
    "meetily.content_revision": 3
  }
}
