{
  "schema_version": 2,
  "id": "sales_marketing_client_call",
  "name": "客户／销售会议",
  "description": "记录客户目标、交付物和后续步骤。",
  "version": 1,
  "locale": "zh-CN",
  "tags": [],
  "source": {
    "type": "builtin",
    "original_file_name": null,
    "original_file_sha256": null,
    "imported_at": null,
    "copied_from_template_id": null
  },
  "created_at": "2026-08-23T00:00:00+08:00",
  "updated_at": "2026-08-23T00:00:00+08:00",
  "sections": [
    {
      "id": "meeting_metadata",
      "title": "会议元数据",
      "instruction": "记录日期、时间、地点／会议形式和客户经理",
      "format": "string",
      "item_format": null,
      "example_item_format": null,
      "required": true,
      "empty_behavior": "show_not_mentioned"
    },
    {
      "id": "attendees",
      "title": "参会人",
      "instruction": "列出客户方与供应方参会人及其角色",
      "format": "list",
      "item_format": null,
      "example_item_format": null,
      "required": true,
      "empty_behavior": "show_not_mentioned"
    },
    {
      "id": "client_goals_success_criteria",
      "title": "客户目标与成功标准",
      "instruction": "记录客户希望达成的目标及成功衡量方式",
      "format": "paragraph",
      "item_format": null,
      "example_item_format": null,
      "required": true,
      "empty_behavior": "show_not_mentioned"
    },
    {
      "id": "agreed_deliverables",
      "title": "约定交付物",
      "instruction": "列出交付物、负责人和截止日期",
      "format": "list",
      "item_format": "| **交付物** | **负责人** | **截止日期** |\n| --- | --- | --- |",
      "example_item_format": null,
      "required": true,
      "empty_behavior": "show_not_mentioned"
    },
    {
      "id": "commercial_terms_discussed",
      "title": "已讨论的商务条款",
      "instruction": "记录已讨论的定价、SLA、付款条款或合同事项",
      "format": "paragraph",
      "item_format": null,
      "example_item_format": null,
      "required": true,
      "empty_behavior": "show_not_mentioned"
    },
    {
      "id": "risks_concerns",
      "title": "风险与顾虑",
      "instruction": "记录客户顾虑、阻塞项或需升级处理的事项",
      "format": "list",
      "item_format": "| **顾虑** | **影响** | **负责人** |\n| --- | --- | --- |",
      "example_item_format": null,
      "required": true,
      "empty_behavior": "show_not_mentioned"
    },
    {
      "id": "next_steps",
      "title": "后续步骤",
      "instruction": "列出行动、负责人和截止日期",
      "format": "list",
      "item_format": "| **负责人** | **行动** | **截止日期** |\n| --- | --- | --- |",
      "example_item_format": null,
      "required": true,
      "empty_behavior": "show_not_mentioned"
    }
  ],
  "extensions": {
    "meetily.content_revision": 1
  }
}
