{
  "schema_version": 2,
  "id": "daily_standup",
  "name": "Daily Standup",
  "description": "Time-boxed daily updates for engineering/product teams.",
  "version": 1,
  "locale": "en",
  "tags": [],
  "source": {
    "type": "builtin",
    "original_file_name": null,
    "original_file_sha256": null,
    "imported_at": null,
    "copied_from_template_id": null
  },
  "created_at": "2026-08-23T00:00:00+08:00",
  "updated_at": "2026-08-23T00:00:00+08:00",
  "sections": [
    {
      "id": "date",
      "title": "Date",
      "instruction": "YYYY-MM-DD",
      "format": "string",
      "item_format": null,
      "example_item_format": null,
      "required": true,
      "empty_behavior": "show_not_mentioned"
    },
    {
      "id": "attendees",
      "title": "Attendees",
      "instruction": "List of participants present",
      "format": "list",
      "item_format": null,
      "example_item_format": null,
      "required": true,
      "empty_behavior": "show_not_mentioned"
    },
    {
      "id": "yesterday",
      "title": "Yesterday",
      "instruction": "What I completed yesterday (short bullets)",
      "format": "list",
      "item_format": null,
      "example_item_format": "| **Owner** | **Completed Work** |\n| --- | --- |",
      "required": true,
      "empty_behavior": "show_not_mentioned"
    },
    {
      "id": "today",
      "title": "Today",
      "instruction": "Planned work for today (short bullets)",
      "format": "list",
      "item_format": null,
      "example_item_format": "| **Owner** | **Planned Work** |\n| --- | --- |",
      "required": true,
      "empty_behavior": "show_not_mentioned"
    },
    {
      "id": "blockers",
      "title": "Blockers",
      "instruction": "Any impediments and owner if known",
      "format": "list",
      "item_format": "| **Owner** | **Blocker** | Impact |\n| --- | --- | --- |",
      "example_item_format": null,
      "required": true,
      "empty_behavior": "show_not_mentioned"
    },
    {
      "id": "notes",
      "title": "Notes",
      "instruction": "Optional quick notes or announcements",
      "format": "paragraph",
      "item_format": null,
      "example_item_format": null,
      "required": true,
      "empty_behavior": "show_not_mentioned"
    }
  ],
  "extensions": {
    "meetily.content_revision": 1
  }
}
