{
  "schema_version": 2,
  "id": "retrospective",
  "name": "Retrospective (Agile)",
  "description": "Sprint retrospective template for continuous improvement.",
  "version": 1,
  "locale": "en",
  "tags": [],
  "source": {
    "type": "builtin",
    "original_file_name": null,
    "original_file_sha256": null,
    "imported_at": null,
    "copied_from_template_id": null
  },
  "created_at": "2026-08-23T00:00:00+08:00",
  "updated_at": "2026-08-23T00:00:00+08:00",
  "sections": [
    {
      "id": "sprint",
      "title": "Sprint",
      "instruction": "Sprint name/number and date range",
      "format": "string",
      "item_format": null,
      "example_item_format": null,
      "required": true,
      "empty_behavior": "show_not_mentioned"
    },
    {
      "id": "attendance",
      "title": "Attendance",
      "instruction": "List of participants",
      "format": "list",
      "item_format": null,
      "example_item_format": null,
      "required": true,
      "empty_behavior": "show_not_mentioned"
    },
    {
      "id": "start_doing",
      "title": "Start Doing",
      "instruction": "Actions or experiments to start next sprint",
      "format": "list",
      "item_format": "| **Idea** | **Proposer** |\n| --- | --- |",
      "example_item_format": null,
      "required": true,
      "empty_behavior": "show_not_mentioned"
    },
    {
      "id": "stop_doing",
      "title": "Stop Doing",
      "instruction": "Practices to stop",
      "format": "list",
      "item_format": "| **Practice** | **Reason** |\n| --- | --- |",
      "example_item_format": null,
      "required": true,
      "empty_behavior": "show_not_mentioned"
    },
    {
      "id": "continue_doing",
      "title": "Continue Doing",
      "instruction": "Practices to continue",
      "format": "list",
      "item_format": "| **Practice** | **Notes** |\n| --- | --- |",
      "example_item_format": null,
      "required": true,
      "empty_behavior": "show_not_mentioned"
    },
    {
      "id": "action_items",
      "title": "Action Items",
      "instruction": "Concrete experiments with owners and success metrics",
      "format": "list",
      "item_format": "| **Owner** | **Task** | **Due Date** | **Success Metric** |\n| --- | --- | --- | --- |",
      "example_item_format": null,
      "required": true,
      "empty_behavior": "show_not_mentioned"
    },
    {
      "id": "notes_votes",
      "title": "Notes & Votes",
      "instruction": "Summary and top-voted items",
      "format": "paragraph",
      "item_format": null,
      "example_item_format": null,
      "required": true,
      "empty_behavior": "show_not_mentioned"
    }
  ],
  "extensions": {
    "meetily.content_revision": 1
  }
}
