{
  "schema_version": 2,
  "id": "retrospective",
  "name": "敏捷回顾会",
  "description": "用于持续改进的迭代回顾会模板。",
  "version": 1,
  "locale": "zh-CN",
  "tags": [],
  "source": {
    "type": "builtin",
    "original_file_name": null,
    "original_file_sha256": null,
    "imported_at": null,
    "copied_from_template_id": null
  },
  "created_at": "2026-08-23T00:00:00+08:00",
  "updated_at": "2026-08-23T00:00:00+08:00",
  "sections": [
    {
      "id": "sprint",
      "title": "迭代",
      "instruction": "记录迭代名称／编号和日期范围",
      "format": "string",
      "item_format": null,
      "example_item_format": null,
      "required": true,
      "empty_behavior": "show_not_mentioned"
    },
    {
      "id": "attendance",
      "title": "出席情况",
      "instruction": "列出参会人员",
      "format": "list",
      "item_format": null,
      "example_item_format": null,
      "required": true,
      "empty_behavior": "show_not_mentioned"
    },
    {
      "id": "start_doing",
      "title": "开始做",
      "instruction": "列出下个迭代开始执行的行动或实验",
      "format": "list",
      "item_format": "| **想法** | **提出人** |\n| --- | --- |",
      "example_item_format": null,
      "required": true,
      "empty_behavior": "show_not_mentioned"
    },
    {
      "id": "stop_doing",
      "title": "停止做",
      "instruction": "列出需要停止的做法",
      "format": "list",
      "item_format": "| **做法** | **原因** |\n| --- | --- |",
      "example_item_format": null,
      "required": true,
      "empty_behavior": "show_not_mentioned"
    },
    {
      "id": "continue_doing",
      "title": "继续做",
      "instruction": "列出需要继续保持的做法",
      "format": "list",
      "item_format": "| **做法** | **备注** |\n| --- | --- |",
      "example_item_format": null,
      "required": true,
      "empty_behavior": "show_not_mentioned"
    },
    {
      "id": "action_items",
      "title": "行动项",
      "instruction": "列出具体实验、负责人和成功指标",
      "format": "list",
      "item_format": "| **负责人** | **任务** | **截止日期** | **成功指标** |\n| --- | --- | --- | --- |",
      "example_item_format": null,
      "required": true,
      "empty_behavior": "show_not_mentioned"
    },
    {
      "id": "notes_votes",
      "title": "备注与投票",
      "instruction": "汇总讨论内容和得票最高的事项",
      "format": "paragraph",
      "item_format": null,
      "example_item_format": null,
      "required": true,
      "empty_behavior": "show_not_mentioned"
    }
  ],
  "extensions": {
    "meetily.content_revision": 1
  }
}
