{
  "schema_version": 2,
  "id": "sales_marketing_client_call",
  "name": "Client / Sales Meeting",
  "description": "Capture client goals, deliverables, and next steps.",
  "version": 1,
  "locale": "en",
  "tags": [],
  "source": {
    "type": "builtin",
    "original_file_name": null,
    "original_file_sha256": null,
    "imported_at": null,
    "copied_from_template_id": null
  },
  "created_at": "2026-08-23T00:00:00+08:00",
  "updated_at": "2026-08-23T00:00:00+08:00",
  "sections": [
    {
      "id": "meeting_metadata",
      "title": "Meeting Metadata",
      "instruction": "Date, time, location/modality, account manager",
      "format": "string",
      "item_format": null,
      "example_item_format": null,
      "required": true,
      "empty_behavior": "show_not_mentioned"
    },
    {
      "id": "attendees",
      "title": "Attendees",
      "instruction": "Client and vendor attendees with roles",
      "format": "list",
      "item_format": null,
      "example_item_format": null,
      "required": true,
      "empty_behavior": "show_not_mentioned"
    },
    {
      "id": "client_goals_success_criteria",
      "title": "Client Goals & Success Criteria",
      "instruction": "What the client wants to achieve and how success will be measured",
      "format": "paragraph",
      "item_format": null,
      "example_item_format": null,
      "required": true,
      "empty_behavior": "show_not_mentioned"
    },
    {
      "id": "agreed_deliverables",
      "title": "Agreed Deliverables",
      "instruction": "Deliverables, owners, and due dates",
      "format": "list",
      "item_format": "| **Deliverable** | **Owner** | **Due Date** |\n| --- | --- | --- |",
      "example_item_format": null,
      "required": true,
      "empty_behavior": "show_not_mentioned"
    },
    {
      "id": "commercial_terms_discussed",
      "title": "Commercial Terms Discussed",
      "instruction": "Pricing, SLAs, payment terms or contract items discussed",
      "format": "paragraph",
      "item_format": null,
      "example_item_format": null,
      "required": true,
      "empty_behavior": "show_not_mentioned"
    },
    {
      "id": "risks_concerns",
      "title": "Risks & Concerns",
      "instruction": "Client concerns, blockers, or escalation items",
      "format": "list",
      "item_format": "| **Concern** | **Impact** | **Owner** |\n| --- | --- | --- |",
      "example_item_format": null,
      "required": true,
      "empty_behavior": "show_not_mentioned"
    },
    {
      "id": "next_steps",
      "title": "Next Steps",
      "instruction": "Actions, owners, and due dates",
      "format": "list",
      "item_format": "| **Owner** | **Action** | **Due Date** |\n| --- | --- | --- |",
      "example_item_format": null,
      "required": true,
      "empty_behavior": "show_not_mentioned"
    }
  ],
  "extensions": {
    "meetily.content_revision": 1
  }
}
